{"schemaVersion":"1.0.0","brand":{"id":"ibm","name":"IBM-design-analysis","description":"An enterprise-marketing canvas faithful to Carbon Design System: white surfaces, charcoal type, IBM Blue (#0f62fe) as the single confident accent, and a deliberately flat-square aesthetic where corners stay at 0–4px. Type runs IBM Plex Sans at light weight 300 for display sizes (a brand signature) and 400/600 for body and emphasis. Cards live as thin-bordered tiles with no shadow; sections separate via subtle gray rows. The chrome is square, the typography is light, and the only color in the system is one assertive blue — the result reads as old-world enterprise gravitas reframed for the cloud era.","source":{"file":"dataset/ibm.json","format":"yaml+markdown"}},"design":{"overview":[{"section":"Overview","content":"IBM's marketing system is a faithful application of **Carbon Design System** — IBM's open-source enterprise design system. The dominant surface is `{colors.canvas}` pure white with `{colors.surface-1}` light gray for elevation, charcoal `{colors.ink}` (#161616) for text, and IBM Blue `{colors.primary}` (#0f62fe) as the single brand accent.\n\nThe defining choice is **flat geometry**: every CTA, every card, every input, every container uses square corners (`{rounded.none}` 0px) with thin 1px borders. There are no rounded pills, no soft shadows, no atmospheric gradients. The system is engineered, not stylized.\n\n**IBM Plex Sans** carries the entire type hierarchy. Display sizes (76 / 60 / 42px) run at weight **300** — IBM's signature light display treatment that makes 76px feel calmer than competing brands' 700-weight display. Body type sits at weight 400 with `letter-spacing: 0.16px` (a Carbon precision detail) and line-height 1.50. The voice reads as careful, technical, and trustworthy.\n\nThe system reaches for color rarely — IBM Blue marks links, primary CTAs, and the rare full-bleed CTA banner. Charcoal carries every other surface that isn't white. The result is enterprise gravitas without the enterprise stiffness: rigorous, light-weighted, and intentionally restrained.\n\n**Key Characteristics:**\n- **Carbon Design System** — IBM's marketing chrome IS Carbon. Buttons are square, inputs are square-with-bottom-rule, corners stay at 0px.\n- **Light-weight display type**: Plex Sans at weight 300 for 42–76px headlines is the brand's typographic signature.\n- **One accent color**: `{colors.primary}` IBM Blue carries every link, primary CTA, and CTA banner. There is no second brand color.\n- White canvas + light gray (`{colors.surface-1}`) + charcoal (`{colors.ink}`) cover 95% of surfaces.\n- Footer inverts to charcoal (`{colors.inverse-canvas}` #161616) — the only dark surface above the page break.\n- Card hierarchy is carried by 1px hairlines and surface change, never by drop shadow.\n- `letter-spacing: 0.16px` on body is a Carbon precision detail — the small positive tracking is part of the brand voice.\n- Page rhythm: utility bar → top nav → hero with light-weight headline → feature card grid → customer logo marquee → enterprise feature row → training section → newsletter / sign-in CTA → dark footer."}],"principles":["**Light-weight display is the brand voice.** Plex Sans at weight 300 for 76px headlines reads as quietly authoritative — switching to 700 would make it look like every other enterprise site.","**Carbon's `letter-spacing: 0.16px`** on body sizes is a precision detail. Don't remove it.","**No mono** on marketing surfaces (Plex Mono exists but lives in product surfaces only).","**Eyebrow typography uses sentence case 14px** — Carbon resists the all-caps tracked eyebrow common to other enterprise brands.","**Line-heights tighten on display, relax on body**: 1.17 at display-xl, 1.50 at body — proportional to size."],"signatureElements":[]},"colors":{"tokens":{"primary":"#0f62fe","on-primary":"#ffffff","ink":"#161616","ink-muted":"#525252","ink-subtle":"#8c8c8c","canvas":"#ffffff","surface-1":"#f4f4f4","surface-2":"#e0e0e0","inverse-canvas":"#161616","inverse-surface-1":"#262626","inverse-ink":"#ffffff","inverse-ink-muted":"#c6c6c6","hairline":"#e0e0e0","hairline-strong":"#161616","blue-60":"#0043ce","blue-80":"#002d9c","blue-hover":"#0050e6","semantic-success":"#24a148","semantic-warning":"#f1c21b","semantic-error":"#da1e28","semantic-info":"#0f62fe"},"guidance":[{"section":"Colors","content":"> Source pages: ibm.com (home), /software/ai-productivity, /consulting, /products/cloud-pak-for-aiops, /products/bare-metal-servers, community.ibm.com."},{"section":"Colors > Brand & Accent","content":"- **IBM Blue** ({colors.primary}): The single brand accent. Links, primary CTAs, CTA banner backgrounds, focus rings.\n- **Blue 60** ({colors.blue-60}): Hovered link state.\n- **Blue 80** ({colors.blue-80}): Pressed primary button.\n- **Blue Hover** ({colors.blue-hover}): Hover state for primary buttons."},{"section":"Colors > Surface","content":"- **Canvas** ({colors.canvas}): Default page background.\n- **Surface 1** ({colors.surface-1}): Light gray (#f4f4f4) — input fields, alternate-row stripes, subtle section bands.\n- **Surface 2** ({colors.surface-2}): Slightly darker gray (#e0e0e0) — disabled fields, hairline-as-fill for separators.\n- **Hairline** ({colors.hairline}): 1px borders on cards, inputs, dividers.\n- **Hairline Strong** ({colors.hairline-strong}): 1px charcoal underline on focused inputs (Carbon's signature focus treatment).\n- **Inverse Canvas** ({colors.inverse-canvas}): Charcoal #161616 — footer surface.\n- **Inverse Surface 1** ({colors.inverse-surface-1}): One step lighter than inverse canvas — footer column dividers, hovered footer items."},{"section":"Colors > Text","content":"- **Ink** ({colors.ink}): All headlines and emphasized body type — charcoal #161616.\n- **Ink Muted** ({colors.ink-muted}): Secondary type at #525252 — meta, sub-headlines, footer body.\n- **Ink Subtle** ({colors.ink-subtle}): Tertiary type at #8c8c8c — disabled, helper text, captions.\n- **Inverse Ink** ({colors.inverse-ink}): White on charcoal — footer headings.\n- **Inverse Ink Muted** ({colors.inverse-ink-muted}): Light gray on charcoal — footer body."},{"section":"Colors > Semantic","content":"- **Success Green** ({colors.semantic-success}): Carbon green-50 — success states.\n- **Warning Yellow** ({colors.semantic-warning}): Carbon yellow-30 — warning states.\n- **Error Red** ({colors.semantic-error}): Carbon red-60 — error states; danger button background.\n- **Info Blue** ({colors.semantic-info}): Identical to primary — informational badges."}]},"typography":{"publicFontsOnly":true,"families":[{"family":"IBM Plex Sans","provider":"Google Fonts","license":"Open-source font","url":"https://fonts.google.com/specimen/IBM+Plex+Sans"}],"styles":{"display-xl":{"fontFamily":"IBM Plex Sans, sans-serif","fontSize":"76px","fontWeight":300,"lineHeight":1.17,"letterSpacing":"-0.5px"},"display-lg":{"fontFamily":"IBM Plex Sans, sans-serif","fontSize":"60px","fontWeight":300,"lineHeight":1.17,"letterSpacing":"-0.4px"},"display-md":{"fontFamily":"IBM Plex Sans, sans-serif","fontSize":"42px","fontWeight":300,"lineHeight":1.2,"letterSpacing":0},"headline":{"fontFamily":"IBM Plex Sans, sans-serif","fontSize":"32px","fontWeight":400,"lineHeight":1.25,"letterSpacing":0},"card-title":{"fontFamily":"IBM Plex Sans, sans-serif","fontSize":"24px","fontWeight":400,"lineHeight":1.33,"letterSpacing":0},"subhead":{"fontFamily":"IBM Plex Sans, sans-serif","fontSize":"20px","fontWeight":400,"lineHeight":1.4,"letterSpacing":0},"body-lg":{"fontFamily":"IBM Plex Sans, sans-serif","fontSize":"18px","fontWeight":400,"lineHeight":1.5,"letterSpacing":0},"body":{"fontFamily":"IBM Plex Sans, sans-serif","fontSize":"16px","fontWeight":400,"lineHeight":1.5,"letterSpacing":"0.16px"},"body-sm":{"fontFamily":"IBM Plex Sans, sans-serif","fontSize":"14px","fontWeight":400,"lineHeight":1.29,"letterSpacing":"0.16px"},"body-emphasis":{"fontFamily":"IBM Plex Sans, sans-serif","fontSize":"14px","fontWeight":600,"lineHeight":1.29,"letterSpacing":"0.16px"},"caption":{"fontFamily":"IBM Plex Sans, sans-serif","fontSize":"12px","fontWeight":400,"lineHeight":1.33,"letterSpacing":"0.32px"},"button":{"fontFamily":"IBM Plex Sans, sans-serif","fontSize":"14px","fontWeight":400,"lineHeight":1.29,"letterSpacing":"0.16px"},"eyebrow":{"fontFamily":"IBM Plex Sans, sans-serif","fontSize":"14px","fontWeight":400,"lineHeight":1.29,"letterSpacing":"0.16px"}},"substitutionAdjustment":null,"guidance":[{"section":"Typography > Font Family","content":"- **IBM Plex Sans** — IBM's open-source source-specific typeface (free for any use). Geometric, slightly humanist, designed specifically for enterprise UI. Fallback: `Arimo, Arimo, sans-serif`.\n\nThe same family carries display, body, and caption — there is no display + body pairing. Hierarchy is carried by **size + weight** rather than by family change. Plex Sans is also free / open-source under the SIL Open Font License — making it the easiest custom face on this list to substitute for in implementation."},{"section":"Typography > Hierarchy","content":"| Token | Size | Weight | Line Height | Letter Spacing | Use |\n|---|---|---|---|---|---|\n| `{typography.display-xl}` | 76px | 300 | 1.17 | -0.5px | Largest hero headline |\n| `{typography.display-lg}` | 60px | 300 | 1.17 | -0.4px | Section opener headlines |\n| `{typography.display-md}` | 42px | 300 | 1.20 | 0 | Sub-section headlines, hero card title |\n| `{typography.headline}` | 32px | 400 | 1.25 | 0 | Card collection heading, FAQ category |\n| `{typography.card-title}` | 24px | 400 | 1.33 | 0 | Feature card title |\n| `{typography.subhead}` | 20px | 400 | 1.40 | 0 | Lead body next to display headlines |\n| `{typography.body-lg}` | 18px | 400 | 1.50 | 0 | Hero subhead, lead paragraphs |\n| `{typography.body}` | 16px | 400 | 1.50 | 0.16px | Default body |\n| `{typography.body-sm}` | 14px | 400 | 1.29 | 0.16px | Card body, footer columns |\n| `{typography.body-emphasis}` | 14px | 600